{
    "schema_version":  "1.0",
    "id":  "power-automate-desktop",
    "name":  "Power Automate Desktop",
    "version":  "2.67.143.26090",
    "priority":  "requested",
    "candidate_status":  "blocked",
    "source_policy":  {
                          "public_url_required":  true,
                          "local_files_are_evidence_only":  true
                      },
    "installer":  {
                      "type":  "unknown",
                      "evidence":  [
                                   "Chocolatey community package powerautomatedesktop exists.",
                                       "No local Scoop manifest found.",
                                       "PR #1 review comments required installer/uninstaller/dependency fixes for a system-wide EXE route; that route is rejected for this no-admin factory."
                                   ]
                  },
    "no_admin":  {
                     "required":  true,
                     "strategy":  "Blocked until a supported current-user, no-UAC, no-HKLM, no-service route exists.",
                     "hard_blockers":  [
                                           "UAC prompt",
                                           "Program Files write",
                                           "HKLM write",
                                           "service or driver registration",
                                           "unofficial or ambiguous source identity"
                                       ]
                 },
    "targets":  {
                    "scoop":  {
                                  "status":  "blocked",
                                  "expected_manifest":  null,
                                  "no_admin_strategy":  "Do not add a Scoop manifest that invokes the system-wide Setup.Microsoft.PowerAutomate.exe route; review findings require admin/machine-scope lifecycle handling."
                              },
                    "chocolatey":  {
                                       "status":  "blocked",
                                       "package_id":  "powerautomatedesktop",
                                       "no_admin_strategy":  "Chocolatey package exists but is not accepted as no-admin without proof that it avoids machine scope, services, drivers, and HKLM."
                                   }
                },
    "duplicate_lookup":  {
                             "scoop_terms":  [
                                                 "power-automate-desktop",
                                                 "Power Automate Desktop"
                                             ],
                             "chocolatey_terms":  [
                                                      "power-automate-desktop",
                                                      "Power Automate Desktop"
                                                  ],
                             "winget_terms":  [
                                                  "Power Automate Desktop"
                                              ]
                         },
    "ci":  {
               "require_contract":  true,
               "require_duplicate_lookup":  true,
               "require_no_admin_evidence":  true
           },
    "track":  "conductor/tracks/power_automate_desktop_20260615/",
    "readiness":  {
                      "state":  "blocked",
                      "runtime_validation":  "blocked",
                      "hardening_report":  "packaging/reports/power-automate-desktop-hardening.md",
                      "smoke_report":  "packaging/reports/power-automate-desktop-noadmin-smoke.md",
                      "last_reviewed":  "2026-06-15",
                      "decision":  "Blocked for no-admin hardening. PR #1 comments were addressed by rejecting the machine-scope Setup.Microsoft.PowerAutomate.exe manifest rather than adding admin install/uninstall behavior."
                  }
}
