{
  "schema_version": "1.0",
  "id": "pencil",
  "name": "Pencil",
  "version": "3.1.1",
  "priority": "requested",
  "candidate_status": "covered",
  "source_policy": {
    "public_url_required": true,
    "local_files_are_evidence_only": true
  },
  "installer": {
    "type": "nsis",
    "evidence": [
      "Local Scoop extras/pencil extracts NSIS app payload into Scoop directory.",
      "Repo-local Chocolatey source is deferred until the upstream installer SHA256 can be verified from a complete trusted artifact."
    ]
  },
  "no_admin": {
    "required": true,
    "strategy": "Use the upstream package-manager route; do not duplicate package logic locally unless upstream route fails no-admin policy.",
    "hard_blockers": [
      "UAC prompt",
      "Program Files write",
      "HKLM write",
      "service or driver registration",
      "unofficial or ambiguous source identity"
    ]
  },
  "targets": {
    "scoop": {
      "status": "covered",
      "expected_manifest": null,
      "no_admin_strategy": "Use upstream Scoop extras/pencil for Evolus Pencil; manifest extracts NSIS app payload into Scoop directory."
    },
    "chocolatey": {
      "status": "deferred",
      "package_id": "pencil",
      "no_admin_strategy": "Package source must use SHA256 only and extract the NSIS app payload with 7-Zip into $toolsDir."
    }
  },
  "duplicate_lookup": {
    "scoop_terms": [
      "pencil",
      "Pencil"
    ],
    "chocolatey_terms": [
      "pencil",
      "Pencil"
    ],
    "winget_terms": [
      "Pencil"
    ]
  },
  "ci": {
    "require_contract": true,
    "require_duplicate_lookup": true,
    "require_no_admin_evidence": true
  },
  "track": "conductor/tracks/pencil_20260615/",
  "readiness": {
    "state": "covered",
    "runtime_validation": "not-required",
    "hardening_report": "packaging/reports/pencil-hardening.md",
    "smoke_report": "packaging/reports/pencil-noadmin-smoke.md",
    "last_reviewed": "2026-06-15",
    "decision": "Upstream Scoop remains covered and is not blocked by Chocolatey deferral. Repo-local Chocolatey packaging remains deferred because the review rejected SHA1 and a complete trusted SHA256 artifact has not yet been verified in this pass."
  }
}
