{
  "schema_version": "1.0",
  "id": "scrcpy",
  "name": "scrcpy",
  "version": "4.0",
  "priority": "requested",
  "candidate_status": "covered",
  "source_policy": {
    "public_url_required": true,
    "local_files_are_evidence_only": true
  },
  "installer": {
    "type": "zip",
    "evidence": [
      "Official Windows release zip includes `scrcpy.exe`, adb helper files, and server payload.",
      "No installer stub is used; manifest-level archive extraction is sufficient.",
      "Existing Scoop coverage is via `bucket/escrcpy.json`, `bucket/guiscrcpy.json`, and `bucket/qtscrcpy.json`; this contract tracks the scrcpy family.",
      "Local Scoop main bucket contains scrcpy.json with ZIP-only extraction and no installer execution."
    ]
  },
  "no_admin": {
    "required": true,
    "strategy": "Use Scoop main bucket scrcpy ZIP extraction and adb/platform-tools dependency; no local extras manifest is required unless upstream coverage regresses.",
    "hard_blockers": [
      "installer-based write path to Program Files",
      "service/driver install attempts",
      "elevated first-run requirements"
    ]
  },
  "targets": {
    "scoop": {
      "status": "covered",
      "expected_manifest": null,
      "no_admin_strategy": "Covered by local Scoop main bucket manifest scrcpy.json using official ZIP extraction; avoid duplicating in extras."
    },
    "chocolatey": {
      "status": "candidate",
      "package_id": "scrcpy",
      "no_admin_strategy": "Use a package that stages release artifacts under Chocolatey package tools dir only; avoid installer helpers that require machine scope."
    }
  },
  "duplicate_lookup": {
    "scoop_terms": [
      "scrcpy",
      "escrcpy",
      "qtscrcpy"
    ],
    "chocolatey_terms": [
      "scrcpy"
    ],
    "winget_terms": [
      "Genymobile.scrcpy",
      "Genymobile scrcpy"
    ]
  },
  "ci": {
    "require_contract": true,
    "require_duplicate_lookup": true,
    "require_no_admin_evidence": true
  },
  "track": "conductor/tracks/scrcpy_20260613/",
  "readiness": {
    "state": "covered",
    "runtime_validation": "not-run",
    "hardening_report": "packaging/reports/scrcpy-hardening.md",
    "smoke_report": "packaging/reports/scrcpy-noadmin-smoke.md",
    "last_reviewed": "2026-06-14",
    "decision": "Covered by Scoop main bucket ZIP-only manifest and adb/platform-tools dependency; do not duplicate in extras unless upstream coverage regresses."
  }
}
