{
  "schema_version": "1.0",
  "id": "tightvnc",
  "name": "TightVNC Full Bundle",
  "version": "2.8.87",
  "priority": "high-signal",
  "candidate_status": "covered",
  "source_policy": {
    "public_url_required": true,
    "local_files_are_evidence_only": true
  },
  "installer": {
    "type": "msi",
    "evidence": [
      "Windows VNC client manifest already exists as `bucket/tightvnc.json`.",
      "Scoop extraction model is used from public upstream MSI URLs; no installer execution is required in this repo.",
      "Full bundle exposes tvnserver.exe; no-admin hardened path is split to tightvnc-viewer."
    ]
  },
  "no_admin": {
    "required": true,
    "strategy": "Keep the existing Scoop full-bundle manifest available as extraction-only coverage, but use the viewer-only extraction route for hardened no-admin Android mirroring unless server behavior is explicitly required and validated.",
    "hard_blockers": [
      "runtime services started by the vendor installer may still occur for optional server modes",
      "admin-required driver or helper registration in selected feature sets",
      "network access prompts during first run"
    ]
  },
  "targets": {
    "scoop": {
      "status": "covered",
      "expected_manifest": "bucket/tightvnc.json",
      "no_admin_strategy": "Existing Scoop manifest extracts the upstream MSI into the Scoop app directory without executing msiexec. Because it exposes tvnserver.exe, prefer tightvnc-viewer for hardened no-admin droidVNC-NG workflows."
    },
    "chocolatey": {
      "status": "deferred",
      "package_id": "tightvnc",
      "no_admin_strategy": "Package remains deferred until a reproducible user-writable packaging approach is validated."
    }
  },
  "duplicate_lookup": {
    "scoop_terms": [
      "tightvnc",
      "tvnviewer"
    ],
    "chocolatey_terms": [
      "tightvnc",
      "glavsoft-tightvnc"
    ],
    "winget_terms": [
      "GlavSoft.TightVNC",
      "TightVNC"
    ]
  },
  "ci": {
    "require_contract": true,
    "require_duplicate_lookup": true,
    "require_no_admin_evidence": true
  },
  "track": "conductor/tracks/tightvnc_20260613/",
  "readiness": {
    "state": "covered",
    "runtime_validation": "not-required",
    "hardening_report": "packaging/reports/tightvnc-hardening.md",
    "smoke_report": "packaging/reports/tightvnc-noadmin-smoke.md",
    "last_reviewed": "2026-06-14",
    "decision": "Scoop full-bundle coverage remains available through bucket/tightvnc.json and is not blocked by Chocolatey deferral. Hardened no-admin desktop-client completion remains carried by tightvnc-viewer."
  }
}
